,title,season,release_date,rate_jw,rate_imdb,popularity,genres,run_time,content_rating,episode_cnt,Synopsis,images,backdrops,ott,link
203,짱구는 못말려 극장판: 액션가면 VS 그래그래 마왕,,1993,76,6.6,0,"['코미디', 'SF', '애니메이션', '액션']",93,,,"아이들은 액션가면을 TV 속의 인물인줄만 알고 동경한다. 짱구는 친구들과 함께 액션 가면 카드를 사모으며 즐거운 하루를 보낸다. 드디어 여름방학이 시작되는데, 아버지가 갑자기 바다로 놀러가자고 한다. 그것은 지구를 지키는 액션가면이 그들을 바다로 유인해낸 것이다.  한편, 우주에서 온 그래그래 마왕은 지구를 지배하기 위해 사람들의 영혼을 빼앗아간다. 짱구는 지구를 지키기 위해 액션가면과 힘을 합치는데...",https://images.justwatch.com/poster/296851844/s592/jjangguneun-mosmalryeo-geugjangpan-aegsyeongamyeon-vs-haigure-mawang,https://www.justwatch.com/images/backdrop/124136479/s1440/jjangguneun-mosmalryeo-geugjangpan-aegsyeongamyeon-vs-haigure-mawang,"['https://www.wavve.com/player/movie?movieid=MV_CR01_DN0000011127', 'http://www.netflix.com/title/80242949', 'https://watcha.com/contents/md76y8O']","['Netflix', 'wavve', 'Watcha']"
204,카르멘 산디에고 - 훔치느냐 마느냐,,2020,38,0.0,0,"['애니메이션', '액션', '가족']",31,,,"상하이에서 임무를 수행하던 아이비와 잭이 바일에 납치된다. 현명한 선택으로 카르멘을 도와라. 직접 참여하는 인터랙티브 범죄 작전, 흥미진진한 모험이 기다린다!",https://images.justwatch.com/poster/200128868/s592/kareumen-sandiego-humcineunya-maneunya,https://www.justwatch.com/images/backdrop/241133726/s1440/kareumen-sandiego-humcineunya-maneunya,['http://www.netflix.com/title/80994695'],['Netflix']
205,조이드 와일드,1.0,2018,43,7.3,0,"['SF', '액션', '애니메이션']",21,,20.0,,https://images.justwatch.com/poster/246608323/s592/시즌-1,https://www.justwatch.com/images/backdrop/250258039/s1440/시즌-1,['http://www.netflix.com/title/81503470'],['Netflix']
206,당신과 자연의 대결: 사파리 대탈주,,2021,63,5.8,1000,"['액션', 'Reality TV']",45,,,"야생 동물 보호구역에서 동물들이 탈출한다. 사라진 동물들을 찾아 안전한 곳으로 보내야 한다. 이 위험한 인터랙티브 모험의 주인공은? 베어 그릴스, 그리고 바로 당신!",https://images.justwatch.com/poster/302814116/s592/animals-on-the-loose-a-you-vs-wild-interactive-movie,https://www.justwatch.com/images/backdrop/241341453/s1440/animals-on-the-loose-a-you-vs-wild-interactive-movie,['http://www.netflix.com/title/81205737'],['Netflix']
207,조선미녀삼총사,,2014,61,5.5,0,"['코미디', '액션']",107,,,"그들이 움직이면 온 나라가 들썩!  떴다! 조선 최고의 현상금 사냥꾼!  죄명 불문! 상대 불문!  완벽한 검거율을 자랑하는 조선 팔도 최고의 현상금 사냥꾼이 나타났다!  으뜸가는 미모와 버금가는 무공을 갖춘 실력파 리더 만능검객 진옥(하지원),  돈 되는 일이라면 무엇이든 접수하는 푼수떼기 주부검객 홍단(강예원),  말보다 주먹이 앞서는 시크한 막내, 터프검객 가비(가인).  사라진 십자경을 찾아달라는 왕의 밀명을 받게 된 삼총사.  이제 그들의 손에 현상금이 아닌 조선의 운명이 걸렸다!  “특명! 위기의 조선을 구하라!”",https://images.justwatch.com/poster/10390171/s592/the-huntresses,https://www.justwatch.com/images/backdrop/10390176/s1440/the-huntresses,"['http://www.netflix.com/title/80085554', 'https://watcha.com/contents/mWL6xjd']","['Netflix', 'Watcha']"
208,파이브 건스,,2001,66,5.9,16000,"['서부', '액션', '범죄', '다큐멘터리']",94,,,"남북전쟁으로 고향을 떠난 지 4년만에 돌아온 프랭크와 제시 제임스 형제. 그들은 콜, 밥, 짐의 영거 삼형제와 함께 시골에서 밭을 일구며 평화롭게 살고 있었다. 그러나 그때, 철도회사 사장인 타데오스는 악명높은 핑커튼 탐정 사무소를 앞세워 농민들의 땅을 헐값으로 사들이려 한다. 이 일로 제시의 어머니마저 돌아가시게 되고 제임스 형제와 영거 형제는 함께 '제임스 영거 갱단'을 만들게 되는데...",https://images.justwatch.com/poster/205641513/s592/paibeu-geonseu,https://www.justwatch.com/images/backdrop/256334137/s1440/paibeu-geonseu,['http://www.netflix.com/title/60020804'],['Netflix']
209,빅매치,,2014,72,6.2,0,"['코미디', '액션', '스릴러']",112,15.0,,"액션은 특급! 질주는 본능! 유머는 옵션!  천재 악당 ‘에이스’(신하균)로부터 납치된 형(이성민)을 구하기 위한 불굴의 파이터 ‘익호’(이정재)의 초특급 무한 질주가 시작된다!  유치장 탈출부터 거대 도박장, 상암 경기장, 서울역에 이르기까지 도심 전체를 무대로 멈추지 않는 질주. 게임의 룰은 단 하나, 멈추면 죽는다. 일생일대 목숨을 건 빅매치가 시작된다!  도심 전체를 무대로 천재 악당(신하균)으로부터 형을 구하기 위한 ‘익호’(이정재)의 무한질주를 그린 초특급 오락액션",https://images.justwatch.com/poster/12101870/s592/big-match,https://www.justwatch.com/images/backdrop/12101883/s1440/big-match,"['https://www.wavve.com/player/movie?movieid=MV_C901_SG0000054122', 'https://watcha.com/contents/m5ZXvVK', 'http://www.netflix.com/title/80076006']","['Netflix', 'wavve', 'Watcha']"
210,Bangkok Breaking,1.0,2021,70,5.8,0,"['범죄', '드라마', '스릴러', '액션']",60,,6.0,"Struggling to earn a living in Bangkok, a man joins an emergency rescue service and realizes he must unravel a citywide conspiracy.",https://images.justwatch.com/poster/250349938/s592/시즌-1,https://www.justwatch.com/images/backdrop/252678982/s1440/시즌-1,['http://www.netflix.com/title/81287826'],['Netflix']
211,애니멀월드,,2018,75,6.5,4000,"['드라마', '스릴러', 'SF', '액션', '판타지', '코미디']",132,15.0,,"병상의 어머니, 쌓일 대로 쌓인 빚, 설상가상으로 친구의 배신까지. 막다른 상황에 몰린 청년이 반강제로 정체불명의 게임에 참가한다. 운이 좋으면 빚을 청산하고 떼돈까지 벌 수 있는 기회. 하지만 운이 나쁘면? 그럼 어떻게 되는 거지?",https://images.justwatch.com/poster/66135490/s592/animal-world,https://www.justwatch.com/images/backdrop/86826041/s1440/animal-world,['http://www.netflix.com/title/81004470'],['Netflix']
212,다이하드 스왓,,2016,65,5.8,4000,['액션'],114,,,"전직 SWAT 팀 대장인 ‘데이빗 헨드릭스’는 작전 중 총에 맞은 후 심리 상담을 받고 있다.  화려한 경력에도 불구하고 일반경찰 업무를 맡고 있는 데이빗에게 엎친 데 덮친 격으로  약물과 폭행을 일삼는 할리우드의 문제아 ‘브로디 워커’의 사회봉사 감독 업무까지 주어진다.  잡범들과의 싸움이 이어지는 힘든 하루가 끝난 뒤 데이빗은 브로디를 데리고 예전 동료들을 찾아  경찰 비밀 훈련소에 갔다가 갑자기 괴한들의 공격을 받는다. 영문도 모른 채 대항해 싸우던 데이빗은  괴한들의 대장이 예전 상관인 코버임을 알게 되고, 그들이 노리는 것이 경찰에 압수되어 보관돼있던  1억 달러의 무기명채권이라는 사실을 알게 되는데..",https://images.justwatch.com/poster/80264952/s592/gridlocked,https://www.justwatch.com/images/backdrop/10092129/s1440/gridlocked,['http://www.netflix.com/title/80097221'],['Netflix']
213,작전,,2009,65,6.2,0,"['범죄', '액션', '스릴러', '드라마']",119,15.0,,"억울한 게 생기면 잠도 못 자는 성격의 강현수(박용하), 찌질한 인생 한 방에 갈아타기 위해 주식에 도전하지만, 순식간에 신용불량자가 된다. 그는 독기를 품고, 수년의 독학으로 이제 실력을 갖춘 프로 개미가 되어 마침내 작전주 하나를 추격해 한번에 수천 만원을 손에 쥔다. 그러나 기쁨도 잠시, 그가 건드린 것은 전직 조폭 출신 황종구(박희순)가 작업중인 작전주였다. 몰매를 맞으며 납치된 현수는 되려 황종구의 작전을 망친 남다른 능력을 인정 받아 대한민국을 뒤흔들 600억 헤비급 작전에 엮이게 된다.  초짜 현수와는 달리, 이번 작전에 가담한 작전멤버들은 대한민국 경제를 돌리는 거물급 프로들! 오랜 조폭 생활을 청산하고 DGS홀딩스를 차려 주식작전 세계에 뛰어든 황종구, 탈세를 원하는 졸부, 비자금을 축적한 정치인 등 상류층의 자산뿐만 아니라 비밀까지 철저하게 관리해주는 유서연(김민정), 서진에셋에서 높은 실적으로 승진 가도를 달리고 있는 작전계 특급 에이스 조민형(김무열), 그리고 작전의 시발점인 대산토건의 대주주 박창주까지 최고의 멤버가 구성되었다.  이들이 벌릴 판은 부실한 건설 회사 대산토건. 작전의 최고 죽이는 아이템이라는 ‘환경 기술’을 이용해, ‘수질 개선 박테리아 연구‘ 를 하고 있는 ‘한결 벤처’에 투자, 유서연의 고객 중 한 명이자, 굴리는 돈이 왠만한 기업보다 커 ‘마산창투’라 불리우는 완벽한 쩐주의 돈을 미끼로, 대산토건 주식을 사들인다. 여기에 쪽집게 분석으로 유명한 언론 스타 김승범의 여론 몰이와 검은 머리 외국인 브라이언 최를 통해 외국 자본을 끌어들이며 판은 걷잡을 수 없이 커져만 가고, 눈 먼 개미들의 돈을 쓸어모으기 시작한다. 대박을 눈 앞에 둔 시점, 너무나 완벽하게 진행되는 작전! 작전멤버들간의 쫓고 쫓기는 또 다른 물밑 작전이 시작되는데.. 대한민국 돈이 움직이는 지상최대의 작전이 시작된다.",https://images.justwatch.com/poster/122197297/s592/the-scam,https://www.justwatch.com/images/backdrop/256930444/s1440/the-scam,"['https://watcha.com/contents/m533kl5', 'https://www.wavve.com/player/movie?movieid=MV_SB01_SB0000000005', 'http://www.netflix.com/title/80165481']","['Netflix', 'wavve', 'Watcha']"
214,야연,,2006,69,6.4,7000,"['드라마', '로맨스', '액션', '판타지', 'Made in Europe']",131,,,"“ 새 황제에게 ‘당신’이라니, ‘황상’이라고 불러야 하지 않는가, 형수? “
 어느 날 황제는 의문의 죽음을 당하고 황제시해의 배후로 의심되는 황제의 동생 ‘리’(유 게)가 황위를 계승한다. 미망인이 된 황후 ‘완’(장쯔이)과 황태자 ‘우 루안’(다니엘 우)의 생사조차 위협을 받게 된 순간, ‘완’은 아무도 예상치 못한 선택을 하는데!  “ 당신을 살리기 위해서라면 난 모든 것을 다 할거예요! “
 선(先)황제에게 간택되면서 어린 날의 연인이었던 ‘우 루안’과의 사랑을 가슴깊이 숨겨야 했던 ‘완’은 아무런 힘도 없는 ‘우 루안’을 살리기 위해 ‘리’와의 재혼이라는 돌이킬 수 없는 결단을 내린다. 아버지의 부음을 듣고 ‘우 루안’은 황궁으로 돌아오지만 숙부에 대한 복수심과 ‘완’의 재혼소식에 절망한다!  “ 절 부르신 건 아버님의 죽음때문인가요, 황후 즉위식 때문인가요? “
 ‘리’는 조카인 ‘우 루안’을 제거하기 위해 끊임없이 자객을 보내고 ‘완’은 ‘우 루안’을 지켜내기 위해 사력을 다하며 무서운 계략을 준비한다. 그리고 이 모든 음모가 절정으로 치달을 즈음, 마침내 ‘리’가 마련한 성대한 한밤의 연회가 열리고 운명의 주인공들은 각자의 비밀을 감춘 채 한자리에 모이는데…  절대 권력을 향한 온갖 계략과 음모로 휩싸인 황궁에서 사랑과 욕망, 음모와 배신을 가슴에 품은 황족들의 화려하고 치명적인 밤의 연회가 절정을 향해 깊어 간다.",https://images.justwatch.com/poster/20270017/s592/yayeon,https://www.justwatch.com/images/backdrop/240293118/s1440/yayeon,"['https://www.wavve.com/player/movie?movieid=MV_CX01_CX0000011504', 'https://watcha.com/contents/mdRL9aW', 'http://www.netflix.com/title/80031899']","['Netflix', 'wavve', 'Watcha']"
215,신의 한 수: 귀수편,,2019,75,6.4,0,['액션'],106,15.0,,바둑으로 모든 것을 잃은 아이 귀수. 유일하게 기대던 스승 허일도마저 잃고 홀로 살아남아 세상을 향한 복수를 계획한다. 운명의 선택은 신의 놀음판에 있다. 자신을 사지로 내몬 냉혹한 내기바둑판으로 뛰어든 귀수는 전국을 돌아다니며 귀신 같이 바둑을 두는 자들과 대결을 펼치는데… 사활을 건 대결! 신의 한 수를 다시 두시겠습니까?,https://images.justwatch.com/poster/155144745/s592/sinyi-han-su-gwisupyeon,https://www.justwatch.com/images/backdrop/152356686/s1440/sinyi-han-su-gwisupyeon,"['http://www.netflix.com/title/81457091', 'https://watcha.com/contents/mObBeZz']","['Netflix', 'Watcha']"
216,마리아,,2019,62,5.0,2000,"['범죄', '액션', '드라마', '스릴러']",89,,,"냉혹한 암살자에서 평범한 주부로, 어두운 과거를 지우고 살아가는 마리아. 하지만 피에 굶주린 갱단이 사랑하는 가족을 위협해오자, 그녀의 킬러 본능이 다시 폭발한다.",https://images.justwatch.com/poster/129471034/s592/maria,https://www.justwatch.com/images/backdrop/129413034/s1440/maria,['http://www.netflix.com/title/80236341'],['Netflix']
217,출동! 선행단,1.0,2022,79,6.9,0,"['액션', '애니메이션', '가족']",20,,20.0,,https://images.justwatch.com/poster/266182707/s592/시즌-1,https://www.justwatch.com/images/backdrop/265840707/s1440/시즌-1,['http://www.netflix.com/title/81191979'],['Netflix']
218,출동! 선행단,2.0,2022,79,6.9,0,"['액션', '애니메이션', '가족']",20,,19.0,,https://images.justwatch.com/poster/271064456/s592/시즌-2,https://www.justwatch.com/images/backdrop/265840707/s1440/시즌-2,['http://www.netflix.com/title/81191979'],['Netflix']
219,당신의 아들,,2018,66,6.1,5000,"['드라마', '스릴러', '범죄', '액션', 'Made in Europe']",103,,,"잔인한 폭행으로 사경을 헤매는 아들, 대체 무슨 일이 있었던 걸까?
 의사 하이메가 무능한 경찰을 대신해, 복수의 칼을 빼 든다.  반드시 응징하리라  아버지의 이름으로",https://images.justwatch.com/poster/178839742/s592/tu-hijo,https://www.justwatch.com/images/backdrop/116991909/s1440/tu-hijo,['http://www.netflix.com/title/80167647'],['Netflix']
220,패스트 카: 슈퍼 카를 이길 차,1.0,2018,77,7.1,1000,"['Reality TV', '액션', '다큐멘터리']",46,15.0,8.0,,https://images.justwatch.com/poster/148600822/s592/시즌-1,https://www.justwatch.com/images/backdrop/53171841/s1440/시즌-1,['http://www.netflix.com/title/80190009'],['Netflix']
221,패스트 카: 슈퍼 카를 이길 차,2.0,2019,77,7.1,1000,"['Reality TV', '액션', '다큐멘터리']",44,15.0,7.0,,https://images.justwatch.com/poster/148600822/s592/시즌-2,https://www.justwatch.com/images/backdrop/53171841/s1440/시즌-2,['http://www.netflix.com/title/80190009'],['Netflix']
222,사호 앤 망간,1.0,2019,65,6.7,0,"['액션', '코미디']",51,,8.0,,https://images.justwatch.com/poster/141520897/s592/시즌-1,https://www.justwatch.com/images/backdrop/240271243/s1440/시즌-1,['http://www.netflix.com/title/81316862'],['Netflix']
223,배틀 로얄 2: 레퀴엠,,2003,54,4.6,20000,"['스릴러', '다큐멘터리', 'SF', '전쟁', '액션', '드라마']",134,,,"나나하라 슈야와 나카가와 노리코가 BR 법에서 살아남은지 3년의 시간이 흘렀다. 테러의 시대로 접어든 세상에서 사람들은 BR 법을 시행한 국가에 대항하여 수도를 파괴하고, 이에 정부는 나나하라를 테러리스트의 중심 인물로 지명수배한다. 반BR법 조직인 '와일드 세븐'의 리더가 된 나나하라는 자신을 사지로 몰아넣었던 어른들을 상대로 선전포고를 하고, 정부는 다시 BR II 라는 법을 제정하여 또 다른 중학교 3학년생들에게 강제로 군복을 입힌다. BR II는 제한 시간 3일 내에 2명씩 태그 매치를 이루어 나나하라를 발견하여 죽이면 승리하는 것이다. 상대가 학생들이라는 것을 모르는 와일드 세븐은 다시 어른들에 의해 서로가 서로를 죽이게 되는데...",https://images.justwatch.com/poster/8805008/s592/batoru-rowaiaru-ii-chinkonka,https://www.justwatch.com/images/backdrop/8805016/s1440/batoru-rowaiaru-ii-chinkonka,"['http://www.netflix.com/title/70012571', 'https://watcha.com/contents/mOlYJnd', 'https://www.wavve.com/player/movie?movieid=MV_CX01_CX0000011171']","['Netflix', 'wavve', 'Watcha']"
224,포인트 블랭크,,2017,66,5.7,14000,"['스릴러', '액션', '범죄', '드라마']",86,,,"병원에 실려 온 살인 용의자를 빼낸 간호사. 납치된 만삭의 아내를 구하려면 싫든 좋든 그가 필요하다. 싸움은 시작됐고, 상대는 부패 경찰. 시간이 없다. 서둘러라.",https://images.justwatch.com/poster/141736586/s592/pointeu-beulraengkeu-2019,https://www.justwatch.com/images/backdrop/137431062/s1440/pointeu-beulraengkeu-2019,['http://www.netflix.com/title/80221677'],['Netflix']
225,토로,,2016,66,5.9,3000,"['드라마', '스릴러', '액션', '범죄', 'Made in Europe']",105,15.0,,전과자 토로의 남동생과 옛 공범은 다시 감옥에 가거나 목숨을 잃을 수도 있는 위험한 일을 맡아 달라고 토로에게 간청한다.,https://images.justwatch.com/poster/1154960/s592/toro-2016,https://www.justwatch.com/images/backdrop/178084441/s1440/toro-2016,['http://www.netflix.com/title/80093107'],['Netflix']
226,짱구는 못말려 극장판:  폭풍수면! 꿈꾸는 세계 대돌격,,2016,76,6.3,0,"['코미디', '애니메이션', '판타지', '가족', '액션']",97,,,"어느 날, 꿈 속에서 거대한 물고기가 나타나 짱구 가족을 한 입에 삼킨 날로 부터 마을 사람들은  모두 잠을 잘 때마다 보고 싶은 꿈을 꾸는 신기한 꿈의 세계로 가게 된다.  하지만 짱구의 유치원에 ‘보라’가 전학 온 날부터 마을 사람들이 꿈꾸는 세계는 점차 악몽으로 변해가는데…",https://images.justwatch.com/poster/126756214/s592/jjangguneun-mosmalryeo-geugjangpan-pogpungsumyeon-ggumgguneun-segye-daedolgyeog,https://www.justwatch.com/images/backdrop/209266333/s1440/jjangguneun-mosmalryeo-geugjangpan-pogpungsumyeon-ggumgguneun-segye-daedolgyeog,"['https://www.wavve.com/player/movie?movieid=MV_CR01_DN0000011156', 'http://www.netflix.com/title/80242953']","['Netflix', 'wavve']"
227,일본침몰,,2006,60,5.6,1000,"['SF', '드라마', '스릴러', '액션']",135,,,"멸망의 전조 대지진의 공습  일본 스루가만에서 강도 10을 넘는 엄청난 파괴력의 대지진이 발생한다. 이어 도쿄, 큐슈 등 전역에서 지진이 발생해 일본 전역은 공포에 휩싸이게 된다. 미국 지질학회는 이것이 일본의 지각 아래 있는 태평양 플레이트가 상부맨틀과 하부맨틀의 경계 면에 급속하게 끼어 들어 일어나는 이상현상으로, 일본열도가 40년 안에 침몰하게 될 것이라는 연구결과를 발표하고…  남은 시간은 1년
 이제 일본에 남겨진 희망은 없다!  미국의 가설에 의문을 품은 지구과학박사 타도코로(토요카와 에츠시)는 독자적으로 조사를 실시, 놀라운 사실을 발견하게 된다. 지구온난화로 인해 발생된 다량의 박테리아가 메탄가스를 생성, 그것이 윤활유 작용을 통해 태평양 플레이트의 움직임을 가속화 시켜 정확히 338일 후 일본이 침몰하게 된다는 것!  혼돈과 공포의 아비규환
 마침내 현실이 된 일본의 멸망  각료들은 국민을 외면한 채 해외로 도망가기 바쁘고, 불안감에 휩싸인 국민들 역시 하늘로 바다로 피난로를 찾아 떠나느라 전국은 아수라장이 된다. 그러는 사이 해일과 분화해 더욱 강해진 지진으로 희생자는 시시각각 늘어나고 타도코로는 일본을 구할 최후의 카드를 내놓는다. 바로 일본열도와 플레이트 사이에 가공할 위력을 지닌 ‘N2’폭약을 투여, 열도와 플레이트를 분리시키는 것. 그러나 작전을 수행하던 중 대원과 함께 ‘N2’폭약을 잃게 된다.  이제 일본에게 남겨진 희망은 없다!
 후지산의 대분화로 1억 2천만 일본국민을 위협하는 가운데, 잠수정 파일럿 오노데라(쿠사나기 츠요시)는 일본의 운명을 걸고 깊은 심해 속으로 들어가는데…",https://images.justwatch.com/poster/20429252/s592/ilboncimmol,https://www.justwatch.com/images/backdrop/78197936/s1440/ilboncimmol,"['https://watcha.com/contents/mdMwyJW', 'https://www.wavve.com/player/movie?movieid=MV_CX01_CX0000011318', 'http://www.netflix.com/title/70085351']","['Netflix', 'wavve', 'Watcha']"
228,프리 투 플레이,,2014,79,7.6,13000,"['다큐멘터리', '액션']",75,,,국적도 배경도 다르다. 하지만 같은 목표로 모였다. 온라인 게임 대회에서 백만 달러 상금을 놓고 경쟁하는 세 프로게이머. 이들에게 게임은 어떤 의미이고 어떤 사연으로 여기까지 오게 됐을까. (넷플릭스),https://images.justwatch.com/poster/11589811/s592/free-to-play,https://www.justwatch.com/images/backdrop/11589815/s1440/free-to-play,['http://www.netflix.com/title/81438157'],['Netflix']
229,슈퍼 키즈 액션 팩,1.0,2022,79,6.5,0,"['액션', '코미디', '가족', '판타지', 'SF', '애니메이션']",22,,19.0,"액션 아카데미의 학생인 슈퍼 영웅 꼬마들. 정의로운 마음, 똑똑한 머리, 강한 힘으로 악당을 무찌르고 나쁜 녀석들에게서 착한 면을 끌어내요. 우린 늘 모든 걸 바로잡거든요!",https://images.justwatch.com/poster/259254364/s592/시즌-1,https://www.justwatch.com/images/backdrop/300962470/s1440/시즌-1,['http://www.netflix.com/title/80993597'],['Netflix']
230,슈퍼 키즈 액션 팩,2.0,2022,79,6.5,0,"['액션', '애니메이션', '코미디', '가족', '판타지', 'SF']",22,,11.0,"슈퍼 영웅 클레이, 렌, 트리나, 와츠가 돌아왔어요! 새로운 친구도 사귀고, 잘못을 바로잡고, 호프 스프링스의 악당이 착한 마음을 갖도록 이끌어 줄 거예요.",https://images.justwatch.com/poster/283500568/s592/시즌-2,https://www.justwatch.com/images/backdrop/300962470/s1440/시즌-2,['http://www.netflix.com/title/80993597'],['Netflix']
231,화급,,1997,72,6.6,0,"['스릴러', '액션', '드라마']",108,15.0,,"최악의 화재, 무슨 수를 써서라도 진압해야 한다! 목숨을 걸고 화재 현장에서 화마와 싸우는 소방대원들. 어떤 불길도 잡을 수 있지만, 개인사를 다잡는 건 쉽지 않은데. 소방관들의 살아있는 캐릭터가 돋보이는 두기봉 감독의 홍콩 영화.",https://images.justwatch.com/poster/27237248/s592/lifeline,https://www.justwatch.com/images/backdrop/302844103/s1440/lifeline,['http://www.netflix.com/title/11546798'],['Netflix']
232,라스트 데이스 오브 아메리칸 크라임,,2020,59,3.8,11000,"['액션', '스릴러', '범죄', '드라마', 'SF']",149,,,"일주일 후면 신호가 켜진다. 범죄 발생을 막기 위해, 개인의 머릿속을 통제하려는 정부. 자유가 사라지기 전에, 베테랑 은행 강도가 일생일대의 마지막 범죄를 계획한다.",https://images.justwatch.com/poster/184658627/s592/raseuteu-deiseu-obeu-amerikan-keuraim,https://www.justwatch.com/images/backdrop/184762956/s1440/raseuteu-deiseu-obeu-amerikan-keuraim,['http://www.netflix.com/title/80198975'],['Netflix']
233,우리는 하비 걸스!,1.0,2018,79,6.9,0,"['액션', '코미디', '가족', '애니메이션']",23,,13.0,,https://images.justwatch.com/poster/162586536/s592/시즌-1,https://www.justwatch.com/images/backdrop/272395025/s1440/시즌-1,['http://www.netflix.com/title/80178941'],['Netflix']
234,우리는 하비 걸스!,2.0,2019,79,6.9,0,"['액션', '코미디', '애니메이션', '가족']",23,,13.0,,https://images.justwatch.com/poster/272395153/s592/시즌-2,https://www.justwatch.com/images/backdrop/272395025/s1440/시즌-2,['http://www.netflix.com/title/80178941'],['Netflix']
235,우리는 하비 걸스!,3.0,2019,79,6.9,0,"['액션', '코미디', '애니메이션', '가족']",24,,13.0,,https://images.justwatch.com/poster/162586536/s592/시즌-3,https://www.justwatch.com/images/backdrop/272395025/s1440/시즌-3,['http://www.netflix.com/title/80178941'],['Netflix']
236,우리는 하비 걸스!,4.0,2020,79,6.9,0,"['액션', '코미디', '애니메이션', '가족']",24,,13.0,,https://images.justwatch.com/poster/199420353/s592/시즌-4,https://www.justwatch.com/images/backdrop/272395025/s1440/시즌-4,['http://www.netflix.com/title/80178941'],['Netflix']
237,인그레스: 디 애니메이션,1.0,2018,74,6.5,0,"['SF', '애니메이션', '액션']",23,15.0,11.0,,https://images.justwatch.com/poster/87775488/s592/시즌-1,https://www.justwatch.com/images/backdrop/87775489/s1440/시즌-1,['http://www.netflix.com/title/80992853'],['Netflix']
