,title,season,release_date,rate_jw,rate_imdb,popularity,genres,run_time,content_rating,episode_cnt,Synopsis,images,backdrops,ott,link
0,오늘부터 패밀리,,2017,78,7.7,24000,['코미디'],126,15.0,,"별난 우연으로 여가수를 알게 된 이혼남. 그녀로부터 큰 부탁을 받는다. 곧 결혼할 그녀의 딸을 위해 아빠가 되어달라는 것. 졸지에 남의 집 가장 행세를 하게 되지만 그는 거짓말이라곤 못 하는 위인이었으니. 이 결혼식, 불안불안하다.",https://images.justwatch.com/poster/141707950/s592/in-the-family,https://www.justwatch.com/images/backdrop/49123464/s1440/in-the-family,[],[]
1,형,,2016,83,7.3,3000,"['드라마', '코미디', '스포츠']",110,,,"유도 국가대표 고두영(도경수)은 경기 도중 불의의 사고를 당하게 되고  이 소식을 들은 사기전과 10범의 형 고두식(조정석)은 눈물의 석방 사기극을 펼친다!  “형은 개뿔, 제발 내 인생에서 꺼져!”  형이 돌아오고 인생이 더 깜깜해졌다!  하루 아침에 앞이 깜깜해진 동생을 핑계로 1년간 보호자 자격으로 가석방 된 두식!.  15년동안 단 한번도 연락이 없던 뻔뻔한 형이 집으로 돌아오고  보호자 노릇은커녕 ‘두영’의 삶을 더 엉망진창으로 만드는데….  남보다 못한 형제의 예측불허 동거가 시작된다!",https://images.justwatch.com/poster/242373784/s592/hyeong,https://www.justwatch.com/images/backdrop/9346914/s1440/hyeong,"['https://watcha.com/contents/md6YxNy', 'http://www.netflix.com/title/80160001']","['Netflix', 'Watcha']"
2,이지 걸,,2019,62,5.6,5000,"['드라마', '코미디', 'Made in Europe']",92,,,"사랑 따위, 난 관심 없어. 숨 쉬듯이 남자를 바꾸며 원하는 걸 얻어내는 사촌 언니. 그녀 덕에 칸에서 호화로운 여름을 맛본 나이마의 가치관이 흔들린다. 명품과 화려한 삶을 누리려면 언니처럼 부자를 만나면 되는 걸까.",https://images.justwatch.com/poster/197992917/s592/une-fille-facile,https://www.justwatch.com/images/backdrop/153946546/s1440/une-fille-facile,['http://www.netflix.com/title/81081603'],['Netflix']
3,이지와 오시,,2020,74,6.4,8000,"['코미디', '로맨스']",113,,,셰프가 되고 싶은 소녀와 복서로 성공하고 싶은 소년. 그들이 서로의 꿈을 위해 동맹을 맺는다. 억만장자인 소녀의 부모를 설득해 돈을 받아낼 것. 일단 계획은 완벽하다. 이대로 흘러가기만 한다면!,https://images.justwatch.com/poster/171148102/s592/isi-and-ossi,https://www.justwatch.com/images/backdrop/164508299/s1440/isi-and-ossi,['http://www.netflix.com/title/81058435'],['Netflix']
4,베스트셀러,,2021,69,6.2,4000,"['드라마', '코미디']",100,,,출판사를 운영하던 아빠가 치매로 요양원에 계셔 가업을 이어받은 엘리자베스는 뚜렷한 히트작을 내지 못해 회사가 매각될 처지에 빠진다. 그러다 오래전 아빠와 거래하던 작가 해리스를 만나게 돼 책을 출판하게 되는데..,https://images.justwatch.com/poster/251466346/s592/best-sellers,https://www.justwatch.com/images/backdrop/250757289/s1440/best-sellers,['http://www.netflix.com/title/81254446'],['Netflix']
5,Jeff Foxworthy: The Good Old Days,,2022,71,6.3,0,"['코미디', '다큐멘터리']",60,15.0,,"Jeff looks back on simpler times as he talks aging, texting and ""sex education,"" then shares one wild story from the Blue Collar Comedy Tour.",https://images.justwatch.com/poster/268546349/s592/jeff-foxworthy-the-good-old-days,https://www.justwatch.com/images/backdrop/268000401/s1440/jeff-foxworthy-the-good-old-days,['http://www.netflix.com/title/81180830'],['Netflix']
6,Sebastian Maniscalco: Stay Hungry,,2019,73,7.1,1000,['코미디'],65,15.0,,"Sebastian Maniscalco brings an acerbically unique approach to peacocks on planes, life hacks, rich in-laws and life's annoyances in this comedy special.",https://images.justwatch.com/poster/114635595/s592/sebastian-maniscalco-stay-hungry,https://www.justwatch.com/images/backdrop/105343084/s1440/sebastian-maniscalco-stay-hungry,['http://www.netflix.com/title/80218104'],['Netflix']
7,빌 버: 알고보면 종이호랑이,,2019,84,8.1,11000,['코미디'],67,,,"입만 열었다 하면 논란을 제조하는 코미디언 빌 버가 런던에 떴다. 예민한 관객들, 남성 페미니스트, 로봇 섹스, 인종 문제까지, 하나도 마음에 드는 게 없다는데. 어떻게 그런 말을 할 수 있냐고? 농담은 농담일 뿐, 오해는 금물!",https://images.justwatch.com/poster/191750077/s592/bill-burr-paper-tiger,https://www.justwatch.com/images/backdrop/145341798/s1440/bill-burr-paper-tiger,['http://www.netflix.com/title/81060174'],['Netflix']
8,파리에선 사랑을,1.0,2018,78,7.1,5000,"['코미디', '로맨스']",27,,8.0,사랑의 도시 파리에서! 헤어진 연인에게 집착하는 엘자. 그녀를 위해 친구들이 돈을 주고 남자를 고용한다. 비밀도 계획도 사랑 앞에선 무용지물이라는 걸 잠시 잊었네?,https://images.justwatch.com/poster/98128147/s592/시즌-1,https://www.justwatch.com/images/backdrop/88857177/s1440/시즌-1,['http://www.netflix.com/title/80190086'],['Netflix']
9,파리에선 사랑을,2.0,2019,78,7.1,5000,"['코미디', '로맨스']",30,,7.0,"엘자가 아르헨티나로 떠난 지, 정확히는 떠난 척 연기한 지 4개월. 거짓말을 더 했다간 사랑도 우정도 위태로울 지경이다. 그러나 우리의 엘자가 진실을 말할 수 있을까?",https://images.justwatch.com/poster/141462568/s592/시즌-2,https://www.justwatch.com/images/backdrop/88857177/s1440/시즌-2,['http://www.netflix.com/title/80190086'],['Netflix']
10,파리에선 사랑을,3.0,2022,78,7.1,5000,"['코미디', '로맨스']",30,,6.0,,https://images.justwatch.com/poster/259099829/s592/시즌-3,https://www.justwatch.com/images/backdrop/88857177/s1440/시즌-3,['http://www.netflix.com/title/80190086'],['Netflix']
11,7번방의 선물,,2013,87,8.1,21000,"['드라마', '코미디']",127,15.0,,최악의 흉악범들이 모인 교도소 7번방에 이상한 놈이 들어왔다! 그는 바로 6살 지능의 딸바보 용구. 평생 죄만 짓고 살아온 7번방 패밀리들에게 떨어진 미션은 바로 용구 딸 예승이를 외부인 절대 출입금지인 교도소에 반.입.하.는.것! 웃음과 감동 가득한 사상초유의 합동작전이 시작된다!,https://images.justwatch.com/poster/217517393/s592/miracle-in-cell-no-7,https://www.justwatch.com/images/backdrop/135793414/s1440/miracle-in-cell-no-7,['http://www.netflix.com/title/70271432'],['Netflix']
12,"내 어깨 위 고양이, 밥",,2016,83,7.3,32000,"['드라마', '가족', '코미디']",100,,,"아무런 희망도 미래도 없는 버스킹 뮤지션 제임스는 길거리에서 상처 입은 고양이 밥을 우연히 발견한다. 자신과 같은 처지인 고양이 밥을 위해 생활비를 모두 쏟아 치료해준 후, 여느 날처럼 거리 버스킹 공연을 시작한 제임스는 평소와 다른 분위기를 눈치채게 된다. 어느샌가 고양이 밥이 제임스 옆자리를 지키고 있었던 것. 평생 한번도 받아보지 못했던 사람들의 따뜻한 환호 속에 제임스는 고양이 밥과 함께 버스킹 공연을 이어나간다. 우연한 만남을 통해 인생의 두번째 기회를 맞이하게 된 제임스와 밥의 버스킹 프로젝트가 계속 되던 중, 이들을 시기한 사람들의 방해로 인해 둘은 인생의 또 다른 시련에 맞닥뜨리게 되는데…",https://images.justwatch.com/poster/183500705/s592/a-street-cat-named-bob,https://www.justwatch.com/images/backdrop/5563941/s1440/a-street-cat-named-bob,"['http://www.netflix.com/title/80131190', 'https://watcha.com/contents/m5QqQEl', 'https://www.wavve.com/player/movie?movieid=MV_C901_SG0000094533']","['Netflix', 'wavve', 'Watcha']"
13,본 투 비 블루,,2015,74,6.9,8000,"['드라마', '음악', '로맨스', '코미디']",97,,,"청춘의 음색을 지닌 뮤지션 '쳇 베이커'  모두가 그의 음악을 사랑했지만,  더 이상 연주를 할 수 없어진 순간  연인 ‘제인’과 트럼펫만이 곁에 남았다.  지금 이 순간이 마지막이라도  들려주고 싶은 음악이 있다.  살아보고 싶은 인생이 있다.  다시, '쳇 베이커'만의 방식으로...",https://images.justwatch.com/poster/189838183/s592/born-to-be-blue,https://www.justwatch.com/images/backdrop/9127192/s1440/born-to-be-blue,['http://www.netflix.com/title/80081276'],['Netflix']
14,빅 코미디 크로스오버: 시트콤 스페셜,1.0,2020,68,5.6,0,"['코미디', '가족']",29,,4.0,,https://images.justwatch.com/poster/202158699/s592/시즌-1,https://www.justwatch.com/images/backdrop/202158712/s1440/시즌-1,['http://www.netflix.com/title/81223007'],['Netflix']
15,코리아 넘버원,1.0,2022,73,7.4,0,"['코미디', 'Reality TV']",46,,8.0,,https://images.justwatch.com/poster/302436832/s592/시즌-1,https://www.justwatch.com/images/backdrop/301770042/s1440/시즌-1,['http://www.netflix.com/title/81610166'],['Netflix']
16,사랑이란 이야기,,2015,73,6.0,0,"['코미디', '로맨스', 'Made in Europe']",107,15.0,,시작은 우연이었다. 바이올린을 켜는 남자와 도도한 여배우. 꿈보다 사랑을 택한 둘의 달콤한 시간. 그러나 서서히 현실에 지쳐갈 때쯤 이들에게 남은 건 무엇이었을까. 둘의 사랑은 같은 곳을 향했을까. 크리스마스가 다가오고 있다.,https://images.justwatch.com/poster/41001752/s592/poveste-de-dragoste,https://www.justwatch.com/images/backdrop/131885555/s1440/poveste-de-dragoste,['http://www.netflix.com/title/81092767'],['Netflix']
17,웨딩 플래너,,2001,63,5.3,83000,"['코미디', '로맨스']",103,,,"뉴욕에서 가장 유명하고 능력 있는 웨딩플래너 메리는 갑부들과 유명 인들의 결혼에 관한 모든 사항을 만족할 만큼 완벽히 처리해 내는 성공한 커리어우먼이다. 항상 웃음을 잃지 않으며 자신감을 보이는 그녀지만 마음속 한 구석엔 언제나 고민으로 가득하다. 그 이유는 바로 자신이 이제 결혼 적령기라는 사실과 또한 실제로 자신이 결혼을 원하고 있다는 사실이다. 하지만 그것보다도 그녀에게는 자신이 기획한 웨딩에서의 신랑같이 멋진 남자들이 존재하지 않다는 것이 더욱 그녀의 마음을 외롭게 한다.  그러던 어느 날, 그녀에게도 동화 속에 나오는 운명적인 만남이 찾아오는데. 그 주인공은 덤프트럭에 치일 뻔한 자신을 구해준 의사 스티브.. 과거 약혼자에게 배신당한 그녀로서는 스티브의 순수하고 따뜻한 모습에 점점 마음이 이끌려갔고 스티브또한 그녀에게 뭔가 묘한 느낌을 받게 된다. 어느 날, 메리는 자신의 고객인 프란에게 약혼자를 소개받는 자리에서 생애 최고의 충격을 받게 되는데...  얼마 전 만난 동화 속 왕자님 스티브가 바로 프란의 약혼자였던 것. 스티브와 서먹서먹한 인사를 나눈 메리는 사업상 잠시 출장을 가야하는 프란을 대신해서 그와 함께 그들의 결혼준비를 하러 다닌다. 그러는 동안 두 사람은 서로에 대해 더 많은 것을 알게되며 가까워지지만 고객과의 사랑은 절대 하지 않겠다는 메리의 의지로 아쉬움만을 남기게 된다. 결국 프란과 스티브의 웨딩플래너 일을 그만두고 오랜 친구인 마사모와 결혼을 결심한 메리. 스스로의 감정을 억제한 채 프란과의 결혼만을 생각하려는 스티브. 결혼식 날이 점점 다가올수록 두 사람의 애타는 가슴은 뜨거워만 가는데.",https://images.justwatch.com/poster/85790192/s592/weding-peulraeneo,https://www.justwatch.com/images/backdrop/200118179/s1440/weding-peulraeneo,"['https://www.wavve.com/player/movie?movieid=MV_CX01_CX0000011409', 'https://watcha.com/contents/mdjaqlO', 'http://www.netflix.com/title/60004427']","['Netflix', 'wavve', 'Watcha']"
18,열여덟의 순간,1.0,2019,39,0.0,0,"['드라마', '코미디']",56,15.0,16.0,,https://images.justwatch.com/poster/140981348/s592/시즌-1,https://www.justwatch.com/images/backdrop/136107628/s1440/시즌-1,['http://www.netflix.com/title/81211266'],['Netflix']
19,Kapil Sharma: I'm Not Done Yet,,2022,75,6.9,3000,['코미디'],54,,,"From the liquid courage behind his tweets to the sobering realities of making it in Mumbai, Kapil's pouring his heart out — with a heavy glug of humor.",https://images.justwatch.com/poster/261642721/s592/kapil-sharma-im-not-done-yet,https://www.justwatch.com/images/backdrop/260919562/s1440/kapil-sharma-im-not-done-yet,['http://www.netflix.com/title/81386962'],['Netflix']
20,크리스마스에 기사가 올까요?,,2019,67,5.6,19000,"['로맨스', '코미디', '드라마', '판타지']",92,,,"용맹한 중세의 기사가 그녀에게 반했습니다. 동화책에나 나올 법한 이야기가 실제로 일어났다. 사랑을 믿지 않는 고등학교 과학 교사에게. 설마, 크리스마스의 악몽인가?",https://images.justwatch.com/poster/172493771/s592/keuriseumaseue-gisaga-olggayo,https://www.justwatch.com/images/backdrop/184717863/s1440/keuriseumaseue-gisaga-olggayo,['http://www.netflix.com/title/81026188'],['Netflix']
21,보안관,,2017,64,5.9,0,"['코미디', '범죄']",115,15.0,,"과잉 수사로 잘리고 낙향한 전직 형사 대호. 보안관을 자처하며 바다만큼 드넓은 오지랖으로 기장 평화를 수호한다. 평화롭던 동네에 비치타운 건설을 위해 성공한 사업가 종진이 서울에서 내려온 그때, 인근 해운대에 마약이 돌기 시작한다. 종진의 모든 행보가 의심스러운 대호는 그를 마약사범으로 의심해 형사의 직감을 부르짖으며 처남 덕만을 조수로 ‘나 홀로 수사’에 나선다. 허나, 민심은 돈 많고 세련되고, 대호의 공격에도 그를 은인으로 모시는 겸손함까지 갖춘 종진에게로 옮겨간 지 오래. 대호는 점점 낙동강 오리알이 되는데…",https://images.justwatch.com/poster/9633297/s592/boangwan,https://www.justwatch.com/images/backdrop/9633312/s1440/boangwan,"['https://www.wavve.com/player/movie?movieid=MV_CI01_LE0000011209', 'http://www.netflix.com/title/81113484', 'https://watcha.com/contents/mW4LxAo']","['Netflix', 'wavve', 'Watcha']"
22,크리스마스 인 아프리카,,2019,69,6.1,16000,"['로맨스', '코미디', '다큐멘터리', '드라마']",85,,,"아들이 대학으로 떠났다. 허전한 마음을 달래기 위해 두 번째 허니문을 계획하는 맨해튼 출신의 천상 뉴요커 케이트 콘래드(크리스틴 데이비스). 하지만 하루아침에 이혼 통보를 받은 그녀는 혼자 아프리카 사파리 여행을 떠난다. 최종 목적지로 향하는 길, 잠비아에서 비행기 조종사 데릭 홀리스턴(롭 로)과 함께 고아가 된 아기 코끼리를 구하게 된 케이트. 그녀는 결국 코끼리 보호구역에서 아기 코끼리를 간호하며 뜻밖의 크리스마스를 보내게 된다. 대자연에서 다시 사랑에 마음을 열게 된 케이트는 뉴욕으로 돌아가게 될까, 모험으로 가득 찬 새로운 인생을 시작하게 될까?",https://images.justwatch.com/poster/153003203/s592/keuriseumaseu-in-apeurika,https://www.justwatch.com/images/backdrop/153003206/s1440/keuriseumaseu-in-apeurika,['http://www.netflix.com/title/80231468'],['Netflix']
23,유니콘 스토어,,2017,65,5.6,20000,"['드라마', '코미디', '판타지']",92,,,"재능을 꽃피우지 못하고 미대를 중퇴한 키트. 더는 꿈만 좇으며 살지 않고자, 회사에 취직한다. 그런 그녀 앞에 나타난 신비한 상점. 이곳에서 유니콘을 데려올 수 있다고?",https://images.justwatch.com/poster/120463323/s592/yunikon-seutoeo,https://www.justwatch.com/images/backdrop/120520707/s1440/yunikon-seutoeo,['http://www.netflix.com/title/81034317'],['Netflix']
24,Lommbock,,2017,73,6.7,3000,"['코미디', 'Made in Europe']",105,,,두바이에서 약혼한 슈테판. 결혼 준비하러 독일에 갔다가 간만에 약을 한다. 근데 이걸 어째. 친구 녀석 때문에 걸려버렸다! 2주 만에 약을 몸에서 빼야 하는 상황. 하지만 갖가지 사건이 끊이질 않으니. 나 두바이로 돌아갈 수 있겠지?,https://images.justwatch.com/poster/142031434/s592/lommbock,https://www.justwatch.com/images/backdrop/26441158/s1440/lommbock,['http://www.netflix.com/title/80191219'],['Netflix']
25,The Prom,,2020,65,5.9,26000,"['코미디', '드라마', '음악']",130,,,"뉴욕의 스타 디디 앨런과 배리 글리크먼에게 심각한 위기가 닥친다. 엄청난 제작비를 쏟은 브로드웨이 공연이 망하면서 경력이 박살 난 것이다. 한편, 인디애나주 작은 마을에선 고등학생 에마 놀런이 전혀 다른 이유로 슬픔에 빠져있다. 교장이 지지해 주는데도 불구하고, 학부모회장이 에마와 그녀의 여자 친구 얼리사가 무도회에 참석하지 못하도록 했기 때문이다. 에마의 고난을 이용하면 이미지를 회복할 수도 있겠다고 판단한 디디와 배리. 역시 재기를 노리는 냉소적인 배우 한 쌍, 앤지와 트렌트의 손을 잡고, 그들은 인디애나로 떠나는데...",https://images.justwatch.com/poster/238537204/s592/the-prom,https://www.justwatch.com/images/backdrop/239548364/s1440/the-prom,['http://www.netflix.com/title/81079914'],['Netflix']
26,피끓는 청춘,,2014,75,6.7,1000,"['드라마', '코미디', '로맨스']",121,15.0,,"영숙은 충청도를 접수한 여자 일진이지만, 홍성농고 전설의 카사노바 중길을 바라보며 애만 태운다. 한편 홍성공고 싸움짱 광식은 좀처럼 마음을 열지 않는 영숙이 야속하기만 한데, 서울 전학생 소희의 등장이 이들 관계에 일대 파란을 일으킨다. 소희 꼬시기에 여념 없는 중길 때문에 속상한 영숙의 마음을 알아챈 광식은 급기야 소희에게 손길을 뻗친다. 이를 저지하기 위해 나선 중길을 지키기 위해 영숙은 눈 하나 꿈쩍 안하고 자신을 던지는 중대한 결심을 하는데…",https://images.justwatch.com/poster/206290345/s592/piggeulhneun-ceongcun,https://www.justwatch.com/images/backdrop/206290347/s1440/piggeulhneun-ceongcun,"['http://www.netflix.com/title/80091302', 'https://watcha.com/contents/mW4LMvL', 'https://www.wavve.com/player/movie?movieid=MV_CI01_LE0000011120']","['Netflix', 'wavve', 'Watcha']"
27,"힘을 내요, 미스터 리",,2019,81,6.9,0,"['드라마', '코미디', '가족']",111,,,"훤칠한 키, 잘생긴 얼굴. 부정할 수 없이 멋진 남자 철수에게는 비밀이 있다. 칼국수집에서 일하는 묘한 매력의 이 남자에게 졸지에 딸이라 불리는 아이 샛별이 나타나면서 의외의 일들이 벌어진다. 철수와 샛별의 예기치 않은 동행은 둘의 관계, 그리고 철수의 과거에 대한 미스터리를 하나둘씩 밝혀가는 여정이 된다.",https://images.justwatch.com/poster/139734548/s592/himeul-naeyo-miseuteo-ri,https://www.justwatch.com/images/backdrop/140565987/s1440/himeul-naeyo-miseuteo-ri,"['https://www.wavve.com/player/movie?movieid=MV_C901_SG0000122981', 'http://www.netflix.com/title/81224799']","['Netflix', 'wavve']"
28,마이 온리 러브송,1.0,2017,83,7.0,0,"['드라마', '로맨스', '코미디', '판타지']",29,15.0,20.0,,https://images.justwatch.com/poster/9606527/s592/시즌-1,https://www.justwatch.com/images/backdrop/9603481/s1440/시즌-1,['http://www.netflix.com/title/80178564'],['Netflix']
29,"가버려라, 2020년",,2020,73,6.8,39000,['코미디'],70,,,"미치도록 지겨웠다. 이대로 보내기는 억울하다. 1년간 울적했으니, 이제 한번 웃어나 볼까. 《블랙 미러》 제작자들이 준비한 사상 최고의 황당한 논평. 잘 가라, 2020년.",https://images.justwatch.com/poster/249168377/s592/gabeoryeora-2020nyeon,https://www.justwatch.com/images/backdrop/240148878/s1440/gabeoryeora-2020nyeon,['http://www.netflix.com/title/81332175'],['Netflix']
30,Missing Home,,2022,87,8.0,1000,"['드라마', '코미디']",114,,,A married couple stages their divorce in order to encourage their estranged adult children to return to their hometown.,https://images.justwatch.com/poster/300783997/s592/ngeri-ngeri-sedap,https://www.justwatch.com/images/backdrop/272126017/s1440/ngeri-ngeri-sedap,['http://www.netflix.com/title/81632937'],['Netflix']
31,카모메 식당,,2006,78,7.2,2000,"['코미디', '드라마']",102,,,"헬싱키의 길모퉁이에 새로 생긴 카모메 식당. 사치에는 주먹밥을 대표 메뉴로 내놓고 손님을 기다리지만 한달 째 파리 한 마리 날아들지 않는다. 어느날, 일본만화 매니아인 토미가 첫 손님으로 찾아와 대뜸 독수리 오형제의 주제가를 묻는가 하면, 눈을 감고 세계지도를 손가락으로 찍은 곳이 핀란드여서 이곳까지 왔다는 미도리가 나타나는 등 하나 둘씩 늘어가는 손님들로 카모메 식당은 활기를 더해가는데…",https://images.justwatch.com/poster/9114227/s592/kamome-sigdang,https://www.justwatch.com/images/backdrop/197924210/s1440/kamome-sigdang,"['http://www.netflix.com/title/81131867', 'https://watcha.com/contents/mJOVpN5', 'https://www.wavve.com/player/movie?movieid=MV_CX01_CX0000011211']","['Netflix', 'wavve', 'Watcha']"
32,말모이,,2019,80,6.9,0,"['드라마', '코미디', '역사']",135,,,"1940년대 우리말이 점점 사라져가고 있는 경성. 극장에서 해고된 후 아들 학비 때문에 가방을 훔치다 실패한 판수. 하필 면접 보러 간 조선어학회 대표가 가방 주인 정환이다. 사전 만드는데 전과자에다 까막눈이라니! 그러나 판수를 반기는 회원들에 밀려 정환은 읽고 쓰기를 떼는 조건으로 그를 받아들인다. 돈도 아닌 말을 대체 왜 모으나 싶었던 판수는 난생처음 글을 읽으며 우리말의 소중함에 눈뜨고, 정환 또한 전국의 말을 모으는 ‘말모이’에 힘을 보태는 판수를 통해 ‘우리’의 소중함에 눈뜬다. 얼마 남지 않은 시간, 바짝 조여오는 일제의 감시를 피해 ‘말모이’를 끝내야 하는데…",https://images.justwatch.com/poster/94558422/s592/malmoi,https://www.justwatch.com/images/backdrop/107739412/s1440/malmoi,"['https://www.wavve.com/player/movie?movieid=MV_CI01_LE0000011228', 'http://www.netflix.com/title/81313507', 'https://watcha.com/contents/mdjwRKw']","['Netflix', 'wavve', 'Watcha']"
33,모 애머: 나는 텍사스의 모하메드다,,2021,62,6.7,0,['코미디'],64,,,"고향 휴스턴 무대에 오른 모 애머. 팬데믹 공포, 브래들리 쿠퍼에게 실망(?)한 사연을 전하고, 후무스라는 말의 도용에 열을 내나 싶더니 덤으로 팁을 알려준다. 아랍어로 슬쩍 욕하는 기술!",https://images.justwatch.com/poster/303440879/s592/mo-amer-mohammed-in-texas,https://www.justwatch.com/images/backdrop/256597771/s1440/mo-amer-mohammed-in-texas,['http://www.netflix.com/title/81435608'],['Netflix']
34,옛날 옛적에... 그리고 지금은,1.0,2022,70,5.4,0,"['SF', '코미디', '판타지']",30,,6.0,어쩔 수 없이 헤어져야 했던 커플. 이제 다른 생에서 서로를 찾아 마을에 내려진 저주를 풀어야 한다. 아무도 사랑에 빠지지 못하는 저주를.,https://images.justwatch.com/poster/266435148/s592/시즌-1,https://www.justwatch.com/images/backdrop/269934815/s1440/시즌-1,['http://www.netflix.com/title/81263779'],['Netflix']
35,칸다사미 따라잡기: 가족 여행,,2021,66,5.1,0,"['로맨스', '코미디']",93,,,이런 결혼 생활은 싫어! 부부만의 시간을 보내는 휴가를 떠나자. 절친이자 사돈지간인 샨티와 제니퍼가 계획을 세운다. 결국 온 가족이 총출동한 시끄러운 여행이 되고 말았지만.,https://images.justwatch.com/poster/246301040/s592/trippin-with-the-kandasamys,https://www.justwatch.com/images/backdrop/248790021/s1440/trippin-with-the-kandasamys,['http://www.netflix.com/title/81307032'],['Netflix']
36,Rajma Chawal,,2018,66,5.7,1000,"['코미디', '드라마', '가족']",129,,,"A father attempts to reconnect with his estranged son through social media, a new world for him.",https://images.justwatch.com/poster/104328878/s592/rajma-chawal,https://www.justwatch.com/images/backdrop/239989123/s1440/rajma-chawal,['http://www.netflix.com/title/81018377'],['Netflix']
37,욕의 품격,1.0,2021,72,6.4,5000,"['코미디', '다큐멘터리']",21,19.0,6.0,,https://images.justwatch.com/poster/240058557/s592/시즌-1,https://www.justwatch.com/images/backdrop/239590314/s1440/시즌-1,['http://www.netflix.com/title/81305757'],['Netflix']
38,터지기 전에,,2020,74,6.5,16000,"['코미디', '공포', '판타지', 'SF', '드라마', '로맨스']",102,,,여느날과 다름없이 수업이 진행되던 평화로운 학교에서 갑작스럽게 한 학생의 몸이 폭발한다(?!)  충격적인 일을 겪게된 아이들은 언제 누가 그런 일을 당할지 모른다는 두려움 속에 내일이 없는 막장스러운 오늘을 보내는데..,https://images.justwatch.com/poster/240088957/s592/teojigijeone,https://www.justwatch.com/images/backdrop/237939966/s1440/teojigijeone,['http://www.netflix.com/title/80204131'],['Netflix']
